{
    "type": "round",
    "material": "copper",
    "numberConductors": 1,
    "conductingDiameter": {
        "nominal": 0.000287
    },
    "outerDiameter": {
        "maximum": 0.000439
    },
    "coating": {
        "type": "insulated",
        "material": {
            "composition": "teflon",
            "name": "Tefzel ETFE",
            "manufacturer": "Dupont",
            "manufacturerPartNumber": "D29A01TXX-1.5",
            "dielectricStrength":[
                {
                    "value": 1800,
                    "thickness": 0.003175
                }
            ],
            "rating": {
                "temperature": 180,
                "voltage": 600
            }
        },
        "numberLayers": 2,
        "thicknessLayers": 3.81e-5,
        "breakdownVoltage": 4500
    }
}